{
  "id": "review-issue-467",
  "issue": 467,
  "timestamp": "2026-07-22T09:29:42Z",
  "reviewedBy": "guardrails skill",
  "status": "PASS",
  "summary": "Issue #467 P2-9-5 Product funnel partition: intent-review spec_fidelity=pass consumed as given. backfill_product_partition paginates A-34 daily list, maps GMV/orders/customers/CTR/conversion, respects CallBudgetGovernor, skips completed partitions, marks failed on mid-pagination error without mark_complete. Impressions/Views deferred (no A-33). Four fixture unit tests pass; no live Partner HTTP.",
  "criticalFindings": [
    {
      "id": "467-convention-module-md",
      "type": "drift",
      "severity": "INFO",
      "actionRequired": false,
      "module": "backend/src/juli_backend/services/analytics_backfill/MODULE.md",
      "description": "Intent-review convention note: MODULE.md documents product partition API and Impressions/Views deferral.",
      "suggestion": "No action required."
    },
    {
      "id": "467-protocol-injection",
      "type": "other",
      "severity": "INFO",
      "actionRequired": false,
      "module": "backend/src/juli_backend/services/analytics_backfill/product_partition.py",
      "description": "Intent-review convention note: ProductPerformanceResource Protocol enables test doubles without live HTTP.",
      "suggestion": "No action required."
    }
  ],
  "modulesTouched": [
    "backend/src/juli_backend/services/analytics_backfill/__init__.py",
    "backend/src/juli_backend/services/analytics_backfill/product_partition.py",
    "backend/src/juli_backend/services/analytics_backfill/MODULE.md",
    "tests/unit/test_analytics_backfill_product_partition.py",
    "tests/fixtures/analytics_backfill/product/a34_page1.json",
    "tests/fixtures/analytics_backfill/product/a34_page2.json"
  ],
  "interfaceChanges": [],
  "moduleDrift": false,
  "driftDetails": [],
  "testCoverage": {
    "acceptance": {
      "total": 5,
      "mapped": 5,
      "unmapped": [],
      "mappings": [
        {
          "criterion": "Fixture pytest: multi-page A-34 \u2192 N product rows; CTR/orders/GMV mapped",
          "test": "tests/unit/test_analytics_backfill_product_partition.py::test_multi_page_a34_upserts_product_rows_with_mapped_metrics"
        },
        {
          "criterion": "Pytest: completed partition skips Partner on resume",
          "test": "tests/unit/test_analytics_backfill_product_partition.py::test_completed_partition_skips_partner_on_resume"
        },
        {
          "criterion": "Pytest: mid-pagination failure \u2192 partition not complete; safe to retry",
          "test": "tests/unit/test_analytics_backfill_product_partition.py::test_mid_pagination_failure_leaves_partition_incomplete"
        },
        {
          "criterion": "Impressions/Views deferred \u2014 product rows mapped metrics assert impressions is None",
          "test": "tests/unit/test_analytics_backfill_product_partition.py::test_multi_page_a34_upserts_product_rows_with_mapped_metrics"
        },
        {
          "criterion": "No live Partner in CI",
          "test": "tests/unit/test_analytics_backfill_product_partition.py::test_no_live_partner_http_in_unit_tests"
        }
      ]
    },
    "unit": {
      "passed": 4,
      "failed": 0
    }
  },
  "recommendations": [],
  "approvalReady": true,
  "reviewerSignoff": null,
  "ownerSignoff": null,
  "mlGates": null,
  "priorReviewBlockers": [],
  "reviewFailures": 0,
  "findings": [
    {
      "id": "467-convention-module-md",
      "type": "drift",
      "severity": "INFO",
      "actionRequired": false,
      "module": "backend/src/juli_backend/services/analytics_backfill/MODULE.md",
      "description": "Intent-review convention note: MODULE.md documents product partition API and Impressions/Views deferral.",
      "suggestion": "No action required."
    },
    {
      "id": "467-protocol-injection",
      "type": "other",
      "severity": "INFO",
      "actionRequired": false,
      "module": "backend/src/juli_backend/services/analytics_backfill/product_partition.py",
      "description": "Intent-review convention note: ProductPerformanceResource Protocol enables test doubles without live HTTP.",
      "suggestion": "No action required."
    }
  ],
  "securityFindings": [],
  "architectureFindings": [
    {
      "id": "467-convention-module-md",
      "type": "drift",
      "severity": "INFO",
      "actionRequired": false,
      "module": "backend/src/juli_backend/services/analytics_backfill/MODULE.md",
      "description": "Intent-review convention note: MODULE.md documents product partition API and Impressions/Views deferral.",
      "suggestion": "No action required."
    }
  ],
  "maintainabilityFindings": [
    {
      "id": "467-convention-module-md",
      "type": "drift",
      "severity": "INFO",
      "actionRequired": false,
      "module": "backend/src/juli_backend/services/analytics_backfill/MODULE.md",
      "description": "Intent-review convention note: MODULE.md documents product partition API and Impressions/Views deferral.",
      "suggestion": "No action required."
    },
    {
      "id": "467-protocol-injection",
      "type": "other",
      "severity": "INFO",
      "actionRequired": false,
      "module": "backend/src/juli_backend/services/analytics_backfill/product_partition.py",
      "description": "Intent-review convention note: ProductPerformanceResource Protocol enables test doubles without live HTTP.",
      "suggestion": "No action required."
    }
  ],
  "phaseRunId": "467-20260722T092700",
  "schemaVersion": "1.0.0",
  "artifactType": "review",
  "reviewStatus": "PASS",
  "severity": "low",
  "suggestedRemediation": [
    "No action required.",
    "No action required."
  ],
  "staticAnalysisExecuted": true,
  "dynamicTestsExecuted": true,
  "sourceImplementationArtifact": "agent-runtime/artifacts/implementations/implementation-issue-467.json"
}
