{
  "id": "review-issue-605",
  "issue": 605,
  "timestamp": "2026-07-30T06:39:38Z",
  "reviewedBy": "guardrails skill",
  "status": "PASS",
  "summary": "Issue #605 CDP-A0-3 bronze orders/returns landing: intent-review spec_fidelity=pass consumed as given. Migration 023 adds bronze append tables with shop/time indexes; batched Bronze*RawPayloadsRepo.append_batch proven by unit tests; migration notes lock webhook_raw_events as read-only audit shim with bronze forward write and no indefinite double-write. WebhookRawEventsRepo unchanged for HTTP audit; no A1 orchestration. 8 unit tests pass.",
  "criticalFindings": [],
  "modulesTouched": [
    "backend/src/juli_backend/database/migrations/versions/023_bronze_orders_returns.py",
    "backend/src/juli_backend/models/models.py",
    "backend/src/juli_backend/repositories/repos.py",
    "tests/unit/test_bronze_orders_returns.py",
    "tests/unit/test_bronze_orders_returns_migration.py",
    "tests/integration/test_migrations.py",
    "agent-runtime/artifacts/implementations/implementation-issue-605.json"
  ],
  "interfaceChanges": [
    {
      "module": "backend/src/juli_backend/repositories/repos.py",
      "interface": "BronzeOrderRawPayloadsRepo.append_batch / BronzeReturnRawPayloadsRepo.append_batch",
      "changeType": "added",
      "breaking": false,
      "description": "Batched append writer for bronze order/return raw payloads."
    }
  ],
  "moduleDrift": false,
  "driftDetails": [],
  "testCoverage": {
    "acceptance": {
      "total": 5,
      "mapped": 5,
      "unmapped": [],
      "mappings": [
        {
          "criterion": "Bronze tables for orders/returns raw payloads exist with shop-scoped time index",
          "test": "tests/unit/test_bronze_orders_returns_migration.py::test_bronze_orders_returns_tables_with_shop_scoped_time_index"
        },
        {
          "criterion": "Batched append API/repo proven by unit or integration test minimal fixture no live Partner",
          "test": "tests/unit/test_bronze_orders_returns.py::test_bronze_append_batch_repo_minimal_fixture_no_live_partner"
        },
        {
          "criterion": "Migration notes document webhook_raw_events read-only audit shim bronze forward write path",
          "test": "tests/unit/test_bronze_orders_returns_migration.py::test_bronze_migration_documents_webhook_raw_events_audit_shim"
        },
        {
          "criterion": "No new writers keep double-writing public audit bronze indefinitely",
          "test": "tests/unit/test_bronze_orders_returns_migration.py::test_bronze_migration_documents_no_indefinite_double_write"
        },
        {
          "criterion": "A1 webhook enqueue targeted fetch orchestration remains out of scope",
          "test": "tests/unit/test_bronze_orders_returns_migration.py::test_bronze_migration_a1_webhook_orchestration_out_of_scope"
        }
      ]
    },
    "unit": {
      "passed": 8,
      "failed": 0
    }
  },
  "recommendations": [],
  "approvalReady": true,
  "reviewerSignoff": null,
  "ownerSignoff": null,
  "mlGates": null,
  "priorReviewBlockers": [],
  "phaseRunId": "2026-07-30T0637Z",
  "sourceImplementationArtifact": "agent-runtime/artifacts/implementations/implementation-issue-605.json",
  "reviewFailures": 0,
  "securityFindings": [],
  "architectureFindings": [],
  "maintainabilityFindings": [],
  "schemaVersion": "1.0.0",
  "artifactType": "review",
  "reviewStatus": "PASS",
  "findings": [],
  "severity": "none",
  "suggestedRemediation": [],
  "staticAnalysisExecuted": true,
  "dynamicTestsExecuted": true
}
